<?xml version="1.0" encoding="UTF-8" ?>
<Elective xmlns="http://vashukevich.it-academy.by/xml/Elective"
xmlns:xsi="http://www.w3.org/2001/XMLSchema-instance"
xsi:schemaLocation="http://vashukevich.it-academy.by/xml/Elective elective.xsd">
    <Course>
        <Title>Java Developer Course</Title>
        <Teachers>
            <Teacher>
                <SurName>Иванов</SurName>
                <Name>Аристарх</Name>
                <Patronymic>Алефтинович</Patronymic>
            </Teacher>

            <Teacher>
                <SurName>Сидоров</SurName>
                <Name>Людвиг</Name>
                <Patronymic>Аристархович</Patronymic>
            </Teacher>
        </Teachers>

        <SumStudents>15</SumStudents>
        <NumberOfHours>120.0</NumberOfHours>
        <CourseStart>2017-01-01</CourseStart>
    </Course>
    <Course>
        <Title>Автоматизированное тестирование</Title>
        <Teachers>
            <Teacher>
               <SurName>Петров</SurName>
               <Name>Петр</Name>
               <Patronymic>Петрович</Patronymic>
            </Teacher>
            <Teacher>
               <SurName>Алексеев</SurName>
               <Name>Алексей</Name>
               <Patronymic>Алексеевич</Patronymic>
            </Teacher>
        </Teachers>
        <SumStudents>20</SumStudents>
        <NumberOfHours>110.0</NumberOfHours>
        <CourseStart>2017-01-01</CourseStart>
    </Course>
</Elective>